{
  "membership_id": "member-001",
  "status": "active",
  "issuer": "org.example.membership-authority",
  "detail": {
    "name": "Alice Example",
    "url": "https://example.org/members/alice"
  },
  "evidence": "https://example.org/evidence/member-001",
  "memberSince": "2024-01-01",
  "memberTill": "2026-12-31"
}